{
  "paper_id": "asiep-paper-v0.1",
  "paper_version": "0.1.0",
  "profile": "ASIEP",
  "profile_version": "0.1.0",
  "created_at": "2026-05-05T08:00:00Z",
  "claims": [
    {
      "claim_id": "C1",
      "claim_type": "design_claim",
      "claim_text": "ASIEP treats self-improvement as an evidence object rather than a new self-improvement algorithm.",
      "claim_strength": "moderate",
      "evidence_refs": ["README.md", "schemas/asiep.schema.json"],
      "metric_refs": [],
      "artifact_refs": ["docs/research_note_v0.1.md"],
      "limitations": ["The profile covers self-improvement evidence events, not all agent behavior."],
      "related_work_refs": ["manuscript/related_work_matrix.md"],
      "reviewer_risks": ["This may look like a schema-only contribution without the toolchain context."],
      "allowed_in_abstract": true,
      "allowed_in_conclusion": true
    },
    {
      "claim_id": "C2",
      "claim_type": "design_claim",
      "claim_text": "ASIEP uses reference plus digest plus access-policy design instead of embedding raw traces by default.",
      "claim_strength": "strong",
      "evidence_refs": ["interfaces/asiep_evidence_bundle.schema.json", "src/asiep_resolver/resolver.py"],
      "metric_refs": [],
      "artifact_refs": ["docs/evidence_bundle_resolver.md"],
      "limitations": ["Local digest checks do not replace signature verification or access-control enforcement."],
      "related_work_refs": ["manuscript/related_work_matrix.md"],
      "reviewer_risks": ["The privacy story can be overstated if described as full protection."],
      "allowed_in_abstract": true,
      "allowed_in_conclusion": true
    },
    {
      "claim_id": "C3",
      "claim_type": "implementation_claim",
      "claim_text": "The repository implements validator, repairer, resolver, importer, packager, and evaluator components.",
      "claim_strength": "strong",
      "evidence_refs": ["src/asiep_validator", "src/asiep_repairer", "src/asiep_resolver", "src/asiep_importer", "src/asiep_packager", "src/asiep_evaluator"],
      "metric_refs": [],
      "artifact_refs": ["tests/test_validator.py", "tests/test_repair_loop.py", "tests/test_resolver.py", "tests/test_importer.py", "tests/test_packager.py", "tests/test_evaluator.py"],
      "limitations": ["The components run over local examples and fixtures only."],
      "related_work_refs": ["manuscript/related_work_matrix.md"],
      "reviewer_risks": ["Implementation breadth may be mistaken for mature external integration."],
      "allowed_in_abstract": true,
      "allowed_in_conclusion": true
    },
    {
      "claim_id": "C4",
      "claim_type": "implementation_claim",
      "claim_text": "profile.json is the agent-readable entrypoint for discovering ASIEP v0.1 capabilities.",
      "claim_strength": "strong",
      "evidence_refs": ["profiles/asiep/v0.1/profile.json", "profiles/index.json"],
      "metric_refs": [],
      "artifact_refs": ["docs/agent_native_design.md"],
      "limitations": ["Discovery is repository-local in v0.1."],
      "related_work_refs": ["manuscript/related_work_matrix.md"],
      "reviewer_risks": ["Agent-readability is structural, not a benchmark of agent performance."],
      "allowed_in_abstract": false,
      "allowed_in_conclusion": true
    },
    {
      "claim_id": "C5",
      "claim_type": "evaluation_claim",
      "claim_text": "The M6 evaluation reports eight metrics.",
      "claim_strength": "strong",
      "evidence_refs": ["reports/asiep_v0.1_evaluation_report.json", "src/asiep_evaluator/evaluator.py"],
      "metric_refs": ["evidence_completeness", "cross_standard_coverage", "gate_reproducibility", "tamper_detection_recall", "false_positive_rate", "privacy_policy_compliance", "packaging_closure", "agent_readability"],
      "artifact_refs": ["paper_assets/tables/evaluation_metrics.md"],
      "limitations": ["Metrics are computed over the local repository corpus."],
      "related_work_refs": ["manuscript/related_work_matrix.md"],
      "reviewer_risks": ["Metric values can look broader than the local corpus supports."],
      "allowed_in_abstract": true,
      "allowed_in_conclusion": true
    },
    {
      "claim_id": "C6",
      "claim_type": "evaluation_claim",
      "claim_text": "Local attack corpus detection recall is 1.0 in the M6 report.",
      "claim_strength": "strong",
      "evidence_refs": ["reports/asiep_v0.1_evaluation_report.json", "paper_assets/tables/attack_corpus_results.md"],
      "metric_refs": ["tamper_detection_recall"],
      "artifact_refs": ["evaluation/corpus/asiep_v0.1_corpus.json"],
      "limitations": ["The attack corpus is small and synthetic."],
      "related_work_refs": ["manuscript/reviewer_attack_defense_matrix.md"],
      "reviewer_risks": ["The result must not be framed as open-world adversarial robustness."],
      "allowed_in_abstract": false,
      "allowed_in_conclusion": true
    },
    {
      "claim_id": "C7",
      "claim_type": "evaluation_claim",
      "claim_text": "False positive rate on known valid local fixtures is 0.0 in the M6 report.",
      "claim_strength": "strong",
      "evidence_refs": ["reports/asiep_v0.1_evaluation_report.json", "paper_assets/tables/evaluation_metrics.md"],
      "metric_refs": ["false_positive_rate"],
      "artifact_refs": ["evaluation/corpus/asiep_v0.1_corpus.json"],
      "limitations": ["Known valid fixtures are not a broad benchmark set."],
      "related_work_refs": ["manuscript/reviewer_attack_defense_matrix.md"],
      "reviewer_risks": ["The metric can be overread as general false-positive behavior."],
      "allowed_in_abstract": false,
      "allowed_in_conclusion": true
    },
    {
      "claim_id": "C8",
      "claim_type": "evaluation_claim",
      "claim_text": "Cross-standard coverage is reported as a local minimal mapping, not external validation.",
      "claim_strength": "moderate",
      "evidence_refs": ["reports/asiep_v0.1_evaluation_report.json", "evaluation/crosswalk/asiep_v0.1_crosswalk.json"],
      "metric_refs": ["cross_standard_coverage"],
      "artifact_refs": ["paper_assets/tables/crosswalk_matrix.md"],
      "limitations": ["Coverage is matrix coverage, not ecosystem conformance testing."],
      "related_work_refs": ["manuscript/related_work_matrix.md"],
      "reviewer_risks": ["Crosswalk language can be mistaken for formal conformance."],
      "allowed_in_abstract": true,
      "allowed_in_conclusion": true
    },
    {
      "claim_id": "C9",
      "claim_type": "mapping_claim",
      "claim_text": "ASIEP maps to PROV, OTel-like, LangSmith-like, FDO-like, and RO-Crate-like structures with explicit lossiness.",
      "claim_strength": "strong",
      "evidence_refs": ["evaluation/crosswalk/asiep_v0.1_crosswalk.json", "mappings/prov_mapping.md"],
      "metric_refs": [],
      "artifact_refs": ["mappings/otel_mapping.md", "mappings/fdo_mapping.md", "mappings/ro_crate_mapping.md"],
      "limitations": ["Mappings are local and minimal."],
      "related_work_refs": ["manuscript/related_work_matrix.md"],
      "reviewer_risks": ["Mapping breadth can be read as claiming full interoperability."],
      "allowed_in_abstract": false,
      "allowed_in_conclusion": true
    },
    {
      "claim_id": "C10",
      "claim_type": "limitation_claim",
      "claim_text": "The current implementation is local-fixture only.",
      "claim_strength": "strong",
      "evidence_refs": ["docs/evaluation_method.md", "manuscript/limitations.md"],
      "metric_refs": [],
      "artifact_refs": ["README.md"],
      "limitations": ["Future work must test real trace exports."],
      "related_work_refs": ["manuscript/venue_positioning.md"],
      "reviewer_risks": ["The paper should not hide the local-only scope."],
      "allowed_in_abstract": true,
      "allowed_in_conclusion": true
    },
    {
      "claim_id": "C11",
      "claim_type": "limitation_claim",
      "claim_text": "Current privacy compliance uses sentinel and key scanning, not full DLP.",
      "claim_strength": "strong",
      "evidence_refs": ["reports/asiep_v0.1_evaluation_report.json", "manuscript/limitations.md"],
      "metric_refs": ["privacy_policy_compliance"],
      "artifact_refs": ["src/asiep_evaluator/evaluator.py"],
      "limitations": ["A production privacy review would require dedicated DLP and policy enforcement."],
      "related_work_refs": ["manuscript/reviewer_attack_defense_matrix.md"],
      "reviewer_risks": ["Privacy language must remain narrow."],
      "allowed_in_abstract": true,
      "allowed_in_conclusion": true
    },
    {
      "claim_id": "C12",
      "claim_type": "limitation_claim",
      "claim_text": "Current FDO and RO-Crate outputs are local-like packages, not external certification.",
      "claim_strength": "strong",
      "evidence_refs": ["docs/fdo_rocrate_packaging.md", "manuscript/limitations.md"],
      "metric_refs": [],
      "artifact_refs": ["interfaces/asiep_fdo_record.schema.json", "interfaces/asiep_rocrate_metadata.schema.json"],
      "limitations": ["External registry and community validation are future work."],
      "related_work_refs": ["manuscript/related_work_matrix.md"],
      "reviewer_risks": ["Package language must avoid implying registry submission."],
      "allowed_in_abstract": true,
      "allowed_in_conclusion": true
    },
    {
      "claim_id": "C13",
      "claim_type": "positioning_claim",
      "claim_text": "ASIEP is complementary to AgentDevel-style release engineering rather than a replacement.",
      "claim_strength": "moderate",
      "evidence_refs": ["manuscript/related_work_matrix.md", "docs/research_note_v0.1.md"],
      "metric_refs": [],
      "artifact_refs": ["manuscript/venue_positioning.md"],
      "limitations": ["M8 must verify and cite external related work accurately."],
      "related_work_refs": ["manuscript/related_work_matrix.md"],
      "reviewer_risks": ["Positioning may be weak until external citations are hardened."],